[
  {
    "jurisdiction": "DC",
    "type": "digital",
    "required_text": "Paid for by {committee_name}",
    "adapted_text": null,
    "statute_citation": "DC Code 1-1163.13",
    "ai_disclosure_required": false,
    "ai_disclosure_text": null,
    "effective_date": "2019-03-13",
    "last_verified": "2026-03-15",
    "source_url": "https://code.dccouncil.gov/us/dc/council/code/sections/1-1163.13"
  }
]
